[
  {
    "statement_id": "statement-BATCH-2026-005-001",
    "source_id": "source-BATCH-2026-005-001",
    "person_id": null,
    "institutional_author": "NIST Center for AI Standards and Innovation",
    "speaker_role_at_source_time": null,
    "organization_at_source_time": "National Institute of Standards and Technology",
    "statement_type": "empirical_finding",
    "neutral_paraphrase": "The NIST authors report broad agreement among RFI commenters that AI agents introduce novel security threats and that security concerns impede adoption.",
    "direct_quote": null,
    "direct_quote_rights_note": null,
    "exact_locator": "Official HTML publication page, Abstract, paragraphs 1-2, accessed 2026-08-15",
    "locator_type": "html_section",
    "source_date": "2026-05-18",
    "topic_ids": [
      "topic-ai-agents",
      "topic-ai-governance",
      "topic-cybersecurity",
      "topic-non-human-identity"
    ],
    "executive_role_context": [
      "role-ciso",
      "role-cio",
      "role-cto",
      "role-general-counsel",
      "role-board-director"
    ],
    "industry_context": [
      "cross-industry"
    ],
    "geographic_context": [
      "United States",
      "global issues discussed"
    ],
    "evidence_character": "qualitative observation reported by government authors",
    "factual_verification_status": "verified_against_exact_source_version",
    "statement_scope": "Self-selected RFI commenters summarized by NIST, not a representative population.",
    "uncertainty": "Response count, composition, coding method, and prevalence threshold for 'widely agreed' are not reported on the accessible page.",
    "extraction_method": "manual reading assisted by text extraction and visual PDF verification",
    "machine_extraction_confidence": 0.94,
    "independent_agent_review_status": "not_started",
    "publication_status": "staging_only",
    "workflow_status": "statements_extracted",
    "machine_review_status": "machine_checked",
    "human_review_status": "pending",
    "reviewed_by": null,
    "reviewed_at": null,
    "provenance": [
      {
        "source_url": "https://www.nist.gov/publications/summary-analysis-responses-request-information-regarding-security-considerations-ai",
        "accessed_at": "2026-08-15",
        "retrieval_method": "manual reading assisted by text extraction and visual PDF verification",
        "exact_locator": "Official HTML publication page, Abstract, paragraphs 1-2, accessed 2026-08-15",
        "content_hash": "32c07aeeb8f49694dd407080eab757c905dc4395871b52edd46a113208064a03",
        "batch_id": "BATCH-2026-005",
        "prompt_id": "OEII-EVIDENCE-RESEARCH",
        "prompt_version": "2.0",
        "notes": "Human review pending."
      }
    ],
    "revision_history": []
  },
  {
    "statement_id": "statement-BATCH-2026-005-002",
    "source_id": "source-BATCH-2026-005-001",
    "person_id": null,
    "institutional_author": "NIST Center for AI Standards and Innovation",
    "speaker_role_at_source_time": null,
    "organization_at_source_time": "National Institute of Standards and Technology",
    "statement_type": "interpretation",
    "neutral_paraphrase": "The NIST authors identify implementation guidance, information sharing, and standards promotion as possible roles for government action.",
    "direct_quote": null,
    "direct_quote_rights_note": null,
    "exact_locator": "Official HTML publication page, Abstract, final sentence, accessed 2026-08-15",
    "locator_type": "html_section",
    "source_date": "2026-05-18",
    "topic_ids": [
      "topic-ai-agents",
      "topic-ai-governance",
      "topic-cybersecurity",
      "topic-non-human-identity"
    ],
    "executive_role_context": [
      "role-ciso",
      "role-cio",
      "role-cto",
      "role-general-counsel",
      "role-board-director"
    ],
    "industry_context": [
      "cross-industry"
    ],
    "geographic_context": [
      "United States",
      "global issues discussed"
    ],
    "evidence_character": "author interpretation and policy option",
    "factual_verification_status": "verified_against_exact_source_version",
    "statement_scope": "Options synthesized from the RFI response corpus.",
    "uncertainty": "The accessible page does not quantify support for each option.",
    "extraction_method": "manual reading assisted by text extraction and visual PDF verification",
    "machine_extraction_confidence": 0.94,
    "independent_agent_review_status": "not_started",
    "publication_status": "staging_only",
    "workflow_status": "statements_extracted",
    "machine_review_status": "machine_checked",
    "human_review_status": "pending",
    "reviewed_by": null,
    "reviewed_at": null,
    "provenance": [
      {
        "source_url": "https://www.nist.gov/publications/summary-analysis-responses-request-information-regarding-security-considerations-ai",
        "accessed_at": "2026-08-15",
        "retrieval_method": "manual reading assisted by text extraction and visual PDF verification",
        "exact_locator": "Official HTML publication page, Abstract, final sentence, accessed 2026-08-15",
        "content_hash": "32c07aeeb8f49694dd407080eab757c905dc4395871b52edd46a113208064a03",
        "batch_id": "BATCH-2026-005",
        "prompt_id": "OEII-EVIDENCE-RESEARCH",
        "prompt_version": "2.0",
        "notes": "Human review pending."
      }
    ],
    "revision_history": []
  },
  {
    "statement_id": "statement-BATCH-2026-005-003",
    "source_id": "source-BATCH-2026-005-002",
    "person_id": null,
    "institutional_author": "National Institute of Standards and Technology",
    "speaker_role_at_source_time": null,
    "organization_at_source_time": "National Institute of Standards and Technology",
    "statement_type": "recommendation",
    "neutral_paraphrase": "Organizations should establish policies for documenting the origin and history of training and generated data while balancing proprietary constraints.",
    "direct_quote": null,
    "direct_quote_rights_note": null,
    "exact_locator": "PDF file p. 18 (document p. 14), table GOVERN 1.2, Action GV-1.2-001, July 2024 version",
    "locator_type": "pdf_page",
    "source_date": null,
    "topic_ids": [
      "topic-ai-agents",
      "topic-ai-governance",
      "topic-cybersecurity",
      "topic-non-human-identity"
    ],
    "executive_role_context": [
      "role-ciso",
      "role-cio",
      "role-cto",
      "role-general-counsel",
      "role-board-director"
    ],
    "industry_context": [
      "cross-industry"
    ],
    "geographic_context": [
      "United States",
      "cross-sectoral global applicability"
    ],
    "evidence_character": "government standards recommendation",
    "factual_verification_status": "verified_against_exact_source_version",
    "statement_scope": "Voluntary cross-sectoral generative-AI risk management.",
    "uncertainty": "Normative guidance; effectiveness is not evaluated.",
    "extraction_method": "manual reading assisted by text extraction and visual PDF verification",
    "machine_extraction_confidence": 0.94,
    "independent_agent_review_status": "not_started",
    "publication_status": "staging_only",
    "workflow_status": "statements_extracted",
    "machine_review_status": "machine_checked",
    "human_review_status": "pending",
    "reviewed_by": null,
    "reviewed_at": null,
    "provenance": [
      {
        "source_url": "https://nvlpubs.nist.gov/nistpubs/ai/NIST.AI.600-1.pdf",
        "accessed_at": "2026-08-15",
        "retrieval_method": "manual reading assisted by text extraction and visual PDF verification",
        "exact_locator": "PDF file p. 18 (document p. 14), table GOVERN 1.2, Action GV-1.2-001, July 2024 version",
        "content_hash": "6e73620ab6b64e90ef2c04bf0e0d6246185a2f4b1b13cab0df494496cff89b6a",
        "batch_id": "BATCH-2026-005",
        "prompt_id": "OEII-EVIDENCE-RESEARCH",
        "prompt_version": "2.0",
        "notes": "Human review pending."
      }
    ],
    "revision_history": []
  },
  {
    "statement_id": "statement-BATCH-2026-005-004",
    "source_id": "source-BATCH-2026-005-002",
    "person_id": null,
    "institutional_author": "National Institute of Standards and Technology",
    "speaker_role_at_source_time": null,
    "organization_at_source_time": "National Institute of Standards and Technology",
    "statement_type": "methodological_claim",
    "neutral_paraphrase": "NIST warns that laboratory benchmarks, in-silico tests, and prompt-jailbreak tests may fail to represent deployment contexts or real-world impacts.",
    "direct_quote": null,
    "direct_quote_rights_note": null,
    "exact_locator": "PDF file p. 53 (document p. 49), Appendix A.1.4, 'Limitations of Current Pre-deployment Test Approaches', July 2024 version",
    "locator_type": "pdf_page",
    "source_date": null,
    "topic_ids": [
      "topic-ai-agents",
      "topic-ai-governance",
      "topic-cybersecurity",
      "topic-non-human-identity"
    ],
    "executive_role_context": [
      "role-ciso",
      "role-cio",
      "role-cto",
      "role-general-counsel",
      "role-board-director"
    ],
    "industry_context": [
      "cross-industry"
    ],
    "geographic_context": [
      "United States",
      "cross-sectoral global applicability"
    ],
    "evidence_character": "methodological limitation",
    "factual_verification_status": "verified_against_exact_source_version",
    "statement_scope": "Pre-deployment testing and evaluation for generative AI.",
    "uncertainty": "The warning is qualitative and not tied to a measured generalization gap.",
    "extraction_method": "manual reading assisted by text extraction and visual PDF verification",
    "machine_extraction_confidence": 0.94,
    "independent_agent_review_status": "not_started",
    "publication_status": "staging_only",
    "workflow_status": "statements_extracted",
    "machine_review_status": "machine_checked",
    "human_review_status": "pending",